{
	"$schema": "http://json-schema.org/draft-07/schema#",
	"title": "CV data",
	"type": "object",
	"additionalProperties": false,
	"required": ["name", "title", "about", "contact", "experience", "education", "skills"],
	"properties": {
		"name": { "type": "string", "minLength": 1 },
		"title": { "type": "string", "minLength": 1 },
		"location": { "type": "string", "minLength": 1 },
		"about": { "type": "string", "minLength": 1 },
		"contact": {
			"type": "object",
			"additionalProperties": false,
			"properties": {
				"email": { "type": "string", "minLength": 1 },
				"linkedin": { "type": "string" },
				"github": { "type": "string" },
				"npm": { "type": "string" }
			}
		},
		"experience": {
			"type": "array",
			"items": {
				"type": "object",
				"additionalProperties": false,
				"required": ["title", "company", "from", "to", "location"],
				"anyOf": [{ "required": ["description"], "properties": { "description": {} } }, { "required": ["highlights"], "properties": { "highlights": {} } }],
				"properties": {
					"title": { "type": "string", "minLength": 1 },
					"company": {
						"type": "object",
						"additionalProperties": false,
						"required": ["name"],
						"properties": {
							"name": { "type": "string", "minLength": 1 },
							"link": { "type": "string" }
						}
					},
					"from": { "type": "string", "minLength": 1 },
					"to": { "type": "string", "minLength": 1 },
					"location": { "type": "string", "minLength": 1 },
					"description": { "type": "string", "minLength": 1 },
					"highlights": {
						"type": "array",
						"minItems": 1,
						"items": { "type": "string", "minLength": 1 }
					}
				}
			}
		},
		"education": {
			"type": "array",
			"items": {
				"type": "object",
				"additionalProperties": false,
				"required": ["institution", "field", "degree", "from", "to"],
				"properties": {
					"institution": { "type": "string", "minLength": 1 },
					"field": { "type": "string", "minLength": 1 },
					"degree": { "type": "string", "minLength": 1 },
					"from": { "type": "string", "minLength": 1 },
					"to": { "type": "string", "minLength": 1 }
				}
			}
		},
		"skills": {
			"type": "object",
			"additionalProperties": {
				"type": "array",
				"minItems": 1,
				"items": { "type": "string", "minLength": 1 }
			}
		},
		"languages": {
			"type": "array",
			"items": {
				"type": "object",
				"additionalProperties": false,
				"required": ["language", "level"],
				"properties": {
					"language": { "type": "string", "minLength": 1 },
					"level": { "type": "string", "minLength": 1 }
				}
			}
		}
	}
}
